{
  "format_version": "1.0",
  "id": "local-automation",
  "display_name": "Local Automation Toolkit",
  "description": "Optional discovery of built-in operating-system scheduling mechanics for monitoring continuity when a harness-native scheduler is unavailable.",
  "responsibility_note": "Use local tools responsibly and only on systems you are allowed to manage.",
  "tools": [
    {
      "id": "launchctl",
      "display_name": "macOS launchd/launchctl",
      "executable": "launchctl",
      "version_args": [],
      "capabilities": ["automation.schedule.manage"],
      "minimum_version": null,
      "minimum_major": null,
      "brew_formula_candidates": [],
      "brew_path_suffix": null,
      "platforms": ["darwin"],
      "limitations": ["Schedule mechanics only; unattended AURA work still requires a compatible noninteractive worker/harness command and an actual verified binding."]
    },
    {
      "id": "systemctl",
      "display_name": "systemd/systemctl",
      "executable": "systemctl",
      "version_args": ["--version"],
      "capabilities": ["automation.schedule.manage"],
      "minimum_version": null,
      "minimum_major": null,
      "brew_formula_candidates": [],
      "brew_path_suffix": null,
      "platforms": ["linux"],
      "limitations": ["Schedule mechanics only; availability of user timers/permissions must be verified before claiming an active schedule."]
    },
    {
      "id": "crontab",
      "display_name": "cron/crontab",
      "executable": "crontab",
      "version_args": [],
      "capabilities": ["automation.schedule.manage"],
      "minimum_version": null,
      "minimum_major": null,
      "brew_formula_candidates": [],
      "brew_path_suffix": null,
      "platforms": ["linux"],
      "limitations": ["Schedule mechanics only; unattended AURA work still requires a compatible worker/harness command."]
    },
    {
      "id": "schtasks",
      "display_name": "Windows Task Scheduler",
      "executable": "schtasks.exe",
      "version_args": [],
      "capabilities": ["automation.schedule.manage"],
      "minimum_version": null,
      "minimum_major": null,
      "brew_formula_candidates": [],
      "brew_path_suffix": null,
      "platforms": ["windows"],
      "limitations": ["Schedule mechanics only; task creation/permissions and the worker command must be verified before claiming an active schedule."]
    }
  ],
  "installers": []
}
