{
  "format_version": "1.0",
  "id": "local-media",
  "display_name": "Local Media Toolkit",
  "description": "Optional local deterministic media acquisition and processing using trusted yt-dlp and FFmpeg/ffprobe executables.",
  "responsibility_note": "Use local tools responsibly and only on content/systems you are allowed to access.",
  "tools": [
    {
      "id": "yt-dlp",
      "display_name": "yt-dlp",
      "executable": "yt-dlp",
      "version_args": ["--version"],
      "capabilities": ["media.video.acquire", "media.transcript.acquire", "media.metadata.inspect"],
      "minimum_version": "2025.01.01",
      "minimum_major": null,
      "brew_formula_candidates": ["yt-dlp"],
      "brew_path_suffix": "bin/yt-dlp",
      "platforms": ["darwin", "linux", "windows"],
      "limitations": [
        "Acquisition mechanics only; does not establish semantic visual/audio understanding.",
        "Do not use AURA to bypass access controls, DRM, authentication restrictions, or unavailable permissions."
      ]
    },
    {
      "id": "ffmpeg",
      "display_name": "FFmpeg",
      "executable": "ffmpeg",
      "version_args": ["-version"],
      "capabilities": ["media.video.process", "media.audio.extract", "media.frame.extract"],
      "minimum_version": null,
      "minimum_major": 6,
      "brew_formula_candidates": ["ffmpeg-full", "ffmpeg"],
      "brew_path_suffix": "bin/ffmpeg",
      "platforms": ["darwin", "linux", "windows"],
      "limitations": ["Deterministic media mechanics only; semantic interpretation still requires a capable model/harness."]
    },
    {
      "id": "ffprobe",
      "display_name": "ffprobe",
      "executable": "ffprobe",
      "version_args": ["-version"],
      "capabilities": ["media.metadata.inspect"],
      "minimum_version": null,
      "minimum_major": 6,
      "brew_formula_candidates": ["ffmpeg-full", "ffmpeg"],
      "brew_path_suffix": "bin/ffprobe",
      "platforms": ["darwin", "linux", "windows"],
      "limitations": ["Inspects deterministic media structure/metadata; does not prove the meaning of visual or spoken content."]
    }
  ],
  "installers": [
    {
      "id": "homebrew",
      "platforms": ["darwin", "linux"],
      "manager": "brew",
      "manager_executable": "brew",
      "install_args": ["install", "yt-dlp", "ffmpeg-full"],
      "upgrade_args": ["upgrade", "yt-dlp", "ffmpeg-full"],
      "repair_args": ["reinstall", "yt-dlp", "ffmpeg-full"],
      "notes": "Use the reviewed Homebrew formula path. A healthy existing standard ffmpeg installation is accepted; ffmpeg-full is the enhanced Homebrew install path when the user opts in."
    }
  ]
}
